{
  "$schema": "https://json-schema.org/draft/2020-12/schema",
  "$id": "https://shipwright.local/schemas/decision_drop.schema.json",
  "title": "Shipwright Decision Drop (iterate F3)",
  "description": "Shape of a single ADR decision-drop JSON file written by shared/scripts/tools/write_decision_drop.py under <project>/.shipwright/agent_docs/decision-drops/<run_id>_<NNN>.json (NNN here is a 3-digit per-run_id counter, not a spec-folder number). Aggregated into decision_log.md at /shipwright-changelog release time by aggregate_decisions.py. Iterate A.3 introduces hard-rejection on the ~500-char per-field budget and the optional spec_ref pointer to .shipwright/planning/adr/<run_id_sanitized>-<slug>.md.",
  "type": "object",
  "additionalProperties": false,
  "required": [
    "run_id",
    "date",
    "section",
    "title",
    "context",
    "decision",
    "consequences"
  ],
  "properties": {
    "run_id": {
      "type": "string",
      "minLength": 1,
      "description": "Iterate run id. Stable across the worktree lifetime; aggregator emits `Run-ID:` line for traceability."
    },
    "date": {
      "type": "string",
      "pattern": "^\\d{4}-\\d{2}-\\d{2}$",
      "description": "ISO 8601 (YYYY-MM-DD) authoring date — preserved on aggregation even if the release runs days later."
    },
    "section": {
      "type": "string",
      "minLength": 1,
      "description": "Free-text section reference, typically `Iterate — <type>: <short description>`."
    },
    "title": {
      "type": "string",
      "description": "Short ADR title rendered after `### ADR-NNN:`."
    },
    "context": {
      "type": "string",
      "maxLength": 500,
      "description": "1-3 sentences explaining why the decision is being made. Hard-rejected at write time if longer; overflow belongs in `spec_ref`."
    },
    "decision": {
      "type": "string",
      "minLength": 1,
      "maxLength": 500,
      "description": "What is being decided. Always present; same length rules as context."
    },
    "consequences": {
      "type": "string",
      "maxLength": 500,
      "description": "What changes downstream if this decision sticks."
    },
    "rationale": {
      "type": "string",
      "maxLength": 500,
      "description": "Optional one-liner answering 'why this choice over alternatives'."
    },
    "rejected": {
      "type": "string",
      "maxLength": 500,
      "description": "Optional list of rejected alternatives (comma-separated or short prose)."
    },
    "commit": {
      "type": "string",
      "description": "Commit SHA, when known at F3 time. Aggregator falls back to `(assigned post-merge)` when empty."
    },
    "architecture_impact": {
      "type": "string",
      "enum": ["component", "data-flow", "convention", "none"],
      "default": "none",
      "description": "Drives the architecture.md / conventions.md follow-up append in aggregate_decisions.py."
    },
    "spec_ref": {
      "type": "string",
      "description": "Optional path (relative to project root) to a long-form ADR spec under `.shipwright/planning/adr/<run_id_sanitized>-<slug>.md` (named by run_id, never a hand-guessed number). Aggregator renders the link as `**Details:** [filename](../planning/adr/...)` underneath the ADR's body bullets."
    }
  }
}
