{
  "run_id": "iterate-2026-08-11-timing-scope-mark-gap",
  "date": "2026-08-12",
  "section": "Iterate — bug: timing scope-mark gap",
  "title": "Deterministic scope mark + hook-backstopped implementation span",
  "context": "TC5.1 fixed throughput-report reading logic, but scope mark and implementation span were agent-prose-only writers that almost never fired (9/10 recent runs degraded).",
  "decision": "Relocate the scope mark into setup_iterate_worktree.py (the one deterministic call every run makes); backstop the implementation span via a new PostToolUse hook keyed off Write/Edit/Bash signals.",
  "consequences": "Throughput reports show real coverage/wall-clock on every run; the hook adds cheap per-call state checks (git-free fast paths for no-active-iterate and cache-hit cases).",
  "rationale": "No single deterministic call exists for the implementation-span boundary itself, so a hook backstop was the only option; scope had one, so it was relocated instead.",
  "rejected": "A third agent-prose reminder (repeats the failure mode); embedding capture in record_review_pass.py (already at the 395-line bloat cap).",
  "commit": "",
  "architecture_impact": "component",
  "spec_ref": ""
}
