{
  "run_id": "iterate-2026-08-17-vite-hono-floor",
  "date": "2026-08-17",
  "section": "Iterate — change: vite-hono-floor",
  "title": "Keeping shipped profile security floors honest over time",
  "context": "vite-hono.json shipped a hono floor vulnerable to CVEs; two consumer repos hand-patched their own copies without the source profile changing.",
  "decision": "Raise the floor to 4.12.34; keep drift prevention narrow (option a) — one pinned regression test, not a general registry+checker (built, then reverted per architecture review).",
  "consequences": "Every future scaffold from vite-hono.json starts at >=4.12.34; this profile's regression is caught, other profiles/packages are not until discovered and given their own pinned test.",
  "rationale": "Two independent architecture reviewers (reject/revise) converged on a single pinned test over a general registry as the smallest thing that would do the job; operator chose to simplify.",
  "rejected": "A live vulnerability-database gate (no live network dep by standing decision); a hand-curated registry+checker (built, reviewed, reverted as disproportionate); scaffold-time resolver script (no chokepoint exists).",
  "commit": "",
  "architecture_impact": "none",
  "spec_ref": ".shipwright/planning/adr/iterate-2026-08-17-vite-hono-floor-profile-floor-drift.md"
}
