{
  "run_id": "iterate-2026-10-24-a3-validator-fixes",
  "date": "2026-10-24",
  "section": "Iterate - bug: phase validator fixes (campaign A3)",
  "title": "Phase validators share the freeze_splits split authority and never pass a canon check that did not run",
  "context": "Before A4 wires the validators into the driven apply path: design looked for per-split mockups the design skill never writes, failed non-UI runs and passed vacuously with no splits; plan checked build_config.current_split; smoke/e2e ignored skip_reason; the canon bridge swallowed ImportError and read the run id only from the environment.",
  "decision": "Design/plan move to phase_validators_split.py and resolve splits via _resolve_splits_with_fallback. Design passes on global screens, else per-split mockups; no-UI = scope=library only, which skips the screen check but not canon (a skipped design task is no exemption). Plan uses the task split (archived split_NN_sections). validate_phase takes split_id/run_id. Canon: absent package/no run id = inform kind=canon_degraded; broken package or empty explicit run id = ask.",
  "consequences": "v1 update-step without SHIPWRIGHT_RUN_ID now records a canon_degraded inform note until A4 passes runId; design with no screens and no splits now asks. A4 must decide how an enforcing gate treats kind=canon_degraded and pass config.get('runId') (not a truthy fallback).",
  "rationale": "Gates cannot be made blocking (A4/A5) while they misjudge valid runs or report unrun checks as passes. Reviews: external plan revise (ImportError narrowed, consumer test added), opus plan + architecture-internal (self-recorded design skip removed, archived splits, find_spec rule), external code revise (split_id with no splits).",
  "rejected": "Ask-level for every degraded canon outcome; trusting a skipped flag in shipwright_design_config.json; reading ux_shape/ui_host now (deferred to the B units, same single no-UI rule).",
  "commit": "",
  "architecture_impact": "none",
  "spec_ref": ""
}
