{
  "run_id": "iterate-2026-08-11-changelog-manifest-version-sync",
  "date": "2026-08-12",
  "section": "shipwright-changelog — release manifest version sync",
  "title": "Write and fail-closed-verify published manifest versions at release, not just gate on them",
  "context": "shipwright-webui 2026-08-10: a release tagged v0.24.0 (CHANGELOG.md + git tag) while bootstrapper/package.json still said 0.23.0 -- the version npm would actually receive. Both external reviewers (Branch A architecture review) proposed the smaller alternative: a read-only pre-tag gate that fails the release if a declared manifest does not already match, leaving the operator to bump it by hand.",
  "decision": "Keep the write+stage+verify-commit mechanism as the card explicitly scoped it (write the version into each declared manifest in the same release commit, so tag and manifest cannot diverge by construction), and descope only the new standing detective check from release-blocking ERROR to informational WARNING.",
  "consequences": "plugins/shipwright-changelog/skills/changelog/SKILL.md crossed its 400-line runtime-prompt limit (399 -> requires exception) adding the new Step 5.4 -- promoted to state=exception in shipwright_bloat_baseline.json (adr=ADR-348, provisional pending sequential aggregation) rather than gutting unrelated pre-existing Step 4 operational documentation to make room.",
  "rationale": "A read-only gate still requires the operator to hand-edit the exact manifest correctly before re-running -- the same fallible step that produced the original drift. The standing check's proportionality objection is separately valid once the pre-tag gate exists: its only job left is catching drift the gate never saw, which does not need release-blocking severity.",
  "rejected": "Read-only pre-tag gate only (both external reviewers' 'smallest thing') -- does not deliver the card's explicit 'by construction' requirement. Standing check at ERROR severity -- would foreclose legitimate post-release manifest edits without special-case handling.",
  "commit": "",
  "architecture_impact": "component",
  "spec_ref": ".shipwright/planning/iterate/iterate-2026-08-11-changelog-manifest-version-sync.md"
}
