{
  "run_id": "iterate-2026-08-08-six-small-defects",
  "date": "2026-08-09",
  "section": "Iterate — bug: six small defects",
  "title": "Harden plan review and best-effort readers",
  "context": "Six independent small defects allowed malformed commands, misleading marker state, fragile routing checks, or failures at malformed input boundaries.",
  "decision": "Use explicit continuations and flags, bounded branch tests, and recovery-preserving reader behavior.",
  "consequences": "Review markers now report only actual fallbacks; malformed external data remains diagnostic instead of crashing readers.",
  "rationale": "Each correction is narrow, regression-tested, and preserves existing interfaces.",
  "rejected": "Broader review-flow redesigns and unrelated reader refactors were excluded.",
  "commit": "",
  "architecture_impact": "none",
  "spec_ref": ""
}
