{
  "run_id": "iterate-2026-08-09-timing-coverage",
  "date": "2026-08-09",
  "section": "TC5.1",
  "title": "Report iterate coverage against scope-to-F5b wall time",
  "context": "The old throughput report treated the timing envelope as wall-clock time and allowed long agent marks to distort timing coverage and duration statistics.",
  "decision": "Measure wall time from the durable scope mark through the work_completed event; report instrumented time and ratio separately; preserve agent intervals beyond name-specific credible limits as unavailable implausible-duration evidence.",
  "consequences": "Historical runs without a scope mark report wall coverage as unavailable. Current zero-emission runs report zero instrumentation. Implausible completed or cancelled agent intervals remain inspectable but do not enter work coverage or phase rollups.",
  "rationale": "Scope and F5b are durable run boundaries; elapsed wall-clock alone does not prove operator wait.",
  "rejected": "Adding duplicate skill boundaries; inferring an operator-wait cause; silently dropping the interval.",
  "commit": "",
  "architecture_impact": "data-flow",
  "spec_ref": ""
}
